{
  "schemaVersion": 1,
  "id": "space_quiet",
  "worldIds": [
    "space"
  ],
  "entityIds": [],
  "entityTags": [],
  "stage": "any",
  "title": "잠시 이어지는 고요",
  "description": "사건들이 지나간 자리에서 다음 시간을 준비한다. 쉬거나 남은 흔적을 돌아볼 여유가 생겼다.",
  "image": "images/events/space_signal.svg",
  "weight": 10,
  "choices": [
    {
      "id": "a",
      "text": "상태를 돌본다",
      "resultText": "급한 움직임을 멈추고 다음 순간을 버틸 힘을 챙겼다.",
      "effects": [
        {
          "op": "addStat",
          "key": "survival",
          "value": 5
        }
      ],
      "branches": []
    },
    {
      "id": "b",
      "text": "지나온 선택을 정리한다",
      "resultText": "무엇을 남길지 생각하며 작은 단서를 정리했다.",
      "effects": [
        {
          "op": "addStat",
          "key": "intelligence",
          "value": 5
        }
      ],
      "branches": []
    }
  ],
  "branches": [],
  "isFallback": true
}
