{
  "schemaVersion": 1,
  "id": "zombie_common_12",
  "worldIds": [
    "zombie"
  ],
  "entityIds": [],
  "entityTags": [],
  "stage": "climax",
  "title": "문을 열 날",
  "description": "봉쇄를 끝낼지 결정할 시간이 왔다. 밖은 여전히 위험하지만 영원한 검역을 약속한 사람도 없다.",
  "image": "images/events/zombie_gate.svg",
  "weight": 10,
  "choices": [
    {
      "id": "a",
      "text": "출입 규칙을 함께 고친다",
      "resultText": "작은 통로에서 새로운 공존의 규칙이 시작됐다.",
      "effects": [
        {
          "op": "addStat",
          "key": "freedom",
          "value": 15
        },
        {
          "op": "setFlag",
          "key": "zombie_reform",
          "value": true
        }
      ],
      "branches": []
    },
    {
      "id": "b",
      "text": "위험을 모두 떠안고 문을 부순다",
      "resultText": "막힌 길은 열렸지만 준비하지 못한 대가가 밀려왔다.",
      "effects": [
        {
          "op": "addStat",
          "key": "survival",
          "value": -25
        },
        {
          "op": "addStat",
          "key": "chaos",
          "value": 25
        },
        {
          "op": "setFlag",
          "key": "zombie_breach",
          "value": true
        }
      ],
      "branches": []
    }
  ],
  "branches": []
}
