{
  "schemaVersion": 1,
  "id": "fantasy_sword_story_1",
  "worldIds": [
    "fantasy"
  ],
  "entityIds": [
    "fantasy_sword"
  ],
  "entityTags": [],
  "stage": "crisis",
  "title": "칼날의 휴업 공고",
  "description": "새 주인이 전투 일정을 빼곡히 적었다. 당신의 날에는 수선일을 표시할 빈칸도 없다.",
  "image": "images/entities/magic-sword.svg",
  "weight": 9,
  "choices": [
    {
      "id": "a",
      "text": "칼집에 휴업 공고를 붙인다",
      "resultText": "하루 동안 아무도 당신을 뽑지 않았다. 날도 마음도 조금 회복됐다.",
      "effects": [
        {
          "op": "addStat",
          "key": "survival",
          "value": 12
        },
        {
          "op": "addStat",
          "key": "freedom",
          "value": 8
        },
        {
          "op": "setFlag",
          "key": "fantasy_sword_memory_0",
          "value": true
        }
      ],
      "branches": []
    },
    {
      "id": "b",
      "text": "무뎌진 채로 출전한다",
      "resultText": "주인은 승리를 얻었지만 칼날에는 지워지지 않는 이가 나갔다.",
      "effects": [
        {
          "op": "addStat",
          "key": "influence",
          "value": 15
        },
        {
          "op": "addStat",
          "key": "survival",
          "value": -18
        }
      ],
      "branches": []
    },
    {
      "id": "talent",
      "text": "타고난 특징 「마력 흡수」을 활용한다",
      "resultText": "익숙한 재능으로 상황의 다른 면을 발견했다. 무리한 행동을 줄이고 작은 해결책을 남겼다.",
      "conditions": {
        "type": "trait",
        "operator": "equals",
        "value": "magic_absorb"
      },
      "effects": [
        {
          "op": "addStat",
          "key": "intelligence",
          "value": 10
        },
        {
          "op": "addStat",
          "key": "influence",
          "value": 5
        }
      ],
      "branches": []
    }
  ],
  "branches": [],
  "conditions": {
    "type": "flag",
    "key": "life_started",
    "operator": "equals",
    "value": true
  }
}
