{
  "schemaVersion": 1,
  "id": "fantasy_dungeon_story_3",
  "worldIds": [
    "fantasy"
  ],
  "entityIds": [
    "fantasy_dungeon"
  ],
  "entityTags": [],
  "stage": "transition",
  "title": "던전 주소 이전 신고",
  "description": "도시 확장 계획에 당신이 철거 대상으로 표시됐다. 건물인지 생명인지 판단할 항목이 신고서에 없다.",
  "image": "images/entities/fantasy_dungeon.svg",
  "weight": 9,
  "choices": [
    {
      "id": "a",
      "text": "주민란에 자기 이름을 쓴다",
      "resultText": "주소와 주민이 같다는 전례가 생겼다. 법정에 의자를 놓을 방도 만들었다.",
      "effects": [
        {
          "op": "addStat",
          "key": "influence",
          "value": 15
        },
        {
          "op": "setFlag",
          "key": "break_system",
          "value": true
        },
        {
          "op": "addStat",
          "key": "chaos",
          "value": 10
        },
        {
          "op": "setFlag",
          "key": "fantasy_dungeon_memory_2",
          "value": true
        }
      ],
      "branches": []
    },
    {
      "id": "b",
      "text": "방을 접어 지하로 내려간다",
      "resultText": "사라진 입구는 도시 전설이 됐다. 혼자서도 이어지는 복도를 얻었다.",
      "effects": [
        {
          "op": "addStat",
          "key": "freedom",
          "value": 15
        },
        {
          "op": "addStat",
          "key": "influence",
          "value": -5
        }
      ],
      "branches": []
    },
    {
      "id": "remember",
      "text": "앞서 남긴 선택을 근거로 도움을 요청한다",
      "resultText": "첫 번째 방의 환불에서 남긴 인연이 답했다. 이번에는 혼자 결정하지 않아도 됐다.",
      "conditions": {
        "type": "flag",
        "key": "fantasy_dungeon_memory_0",
        "operator": "equals",
        "value": true
      },
      "effects": [
        {
          "op": "addStat",
          "key": "survival",
          "value": 8
        },
        {
          "op": "addStat",
          "key": "influence",
          "value": 8
        }
      ],
      "branches": []
    }
  ],
  "branches": [],
  "conditions": {
    "type": "flag",
    "key": "life_started",
    "operator": "equals",
    "value": true
  }
}
